title	description	date	amount	areasOfInterest	link
Longview	We recommended a grant to support Longview’s independent grantmaking on global priorities research, nuclear weapons policy, and other longtermist issues.	February 2022	$15,000,000		https://www.longview.org/
Global Guessing	We recommended a grant to support Global Guessing’s forecasting coverage on the Russian invasion of Ukraine, which they will also use to build tools and infrastructure to support future forecasting work.	May 2022	$336,000	Epistemic Institutions|Great Power Relations	
Brian Christian, Author	We recommended a grant to support the completion of a book which explores the nature of human values and the implications for aligning AI with human preferences.	May 2022	$300,000	Artificial Intelligence	
Sage	We recommended a grant to support the creation of a pilot version of a forecasting platform, and a paid forecasting team, to make predictions about questions relevant to high-impact research.	May 2022	$700,000	Epistemic Institutions	
EffiSciences	We recommended a grant to support EffiSciences’s work promoting high impact research on global priorities (e.g. AI safety, biosecurity, and climate change) among French students and academics, and building up a community of people willing to work on important topics.	April 2022	$135,000	Effective Altruism	https://www.effisciences.org/
Anysphere	We recommended an investment to build a communication platform that provably leaks zero metadata.	May 2022	$200,000		https://anysphere.co
1Day Sooner	We recommended a grant to support 1DS’ work on pandemic preparedness, including advocacy for advance market purchase commitments, collaboration with the UK Pandemic Ethics Accelerator on challenge studies, and advocacy with 1Day Africa and the West African Health Organization for a global pandemic insurance fund.	June 2022	$350,000	Biorisk and Recovery from Catastrophe	https://www.1daysooner.org/
Cecil Abungu, Centre for the Study of Existential Risk, University of Cambridge	We recommended a grant to Cecil Abungu, Visiting Researcher at the Centre for the Study of Existential Risk and Research Affiliate at the Legal Priorities Project, to support the writing and publication of a book on longtermist currents in historical African thought.	May 2022	$160,000		
Luke Hewitt	We recommended a grant to support the development and application of a Minimum Viable Product of a data-driven approach to improving advocacy in areas of importance to societal well-being such as immigration policy.	March 2022	$150,000	Epistemic Institutions|Empowering Exceptional People	
Dr. Emilio I. Alarcón, University of Ottawa Heart Institute & University of Ottawa	This grant will support a project to develop new plastic surfaces incorporating molecules that can be activated with low-energy visible light to eradicate bacteria and kill viruses continuously. If successful, this project will change how plastic surfaces are currently decontaminated.	March 2022	$250,000	Biorisk and Recovery from Catastrophe	https://www.beatsresearch.com/
Rajalakshmi Children Foundation	We recommended a grant to support the identification of children in India from under-resourced areas who excel in math, science, and technology, and enable them to obtain high quality online education by digitally connecting them with mentors and teachers.	May 2022	$200,000	Empowering Exceptional People	https://www.rajalakshmifoundation.in/pratibhaposhak
Nikki Teran, Institute for Progress	We recommended a grant to support the creation of biosecurity policy priorities via conversations with experts in security, technology, policy, and advocacy. It will develop position papers, research papers, and agendas for the biosecurity community.	May 2022	$135,000	Biorisk and Recovery from Catastrophe	
James Lin	We recommended a grant to allow a reputable technology publication to engage 2-5 undergraduate student interns to write about topics including AI safety, alternative proteins, and biosecurity.	May 2022	$190,000	Artificial Intelligence|Biorisk and Recovery from Catastrophe	
Ray Amjad	We recommended a grant to support the creation of a talent search organization which will help identify top young students around the world through a free to use website consisting of both challenging math and physics olympiad-style problems and discussion forums. Efforts will be particularly focused across India and China. These students will later be connected to support and programs so they can go on to work on the world's most pressing issues.	May 2022	$300,000	Empowering Exceptional People	
The Center for Election Science	We recommended a grant to support the development of statewide ballot initiatives to institute approval voting. Approval voting is a simple voting method reform that lets voters select all the candidates they wish.	March 2022	$300,000	Epistemic Institutions|Values and Reflective Processes	https://electionscience.org/
AVECRIS Pte. Ltd.	We recommended an investment in AVECRIS’s Project DOOR to support the development of a next generation genetic vaccine platform that aims to allow for highly distributed vaccine production using AVECRIS’s advanced DNA vector delivery technology.	May 2022	$3,600,000	Biorisk and Recovery from Catastrophe	
Council on Strategic Risks	We recommended a grant to support a project which will develop and advance ideas for strengthening regional and multilateral cooperation for addressing biological risks and filling gaps in current international institutions. These efforts include promoting the creation of a center with the capacity to rapidly respond to emerging infectious disease threats to prioritize blunting the impact of such events as well as quickly saving lives, and cooperative mechanisms to enhance biosafety and biosecurity while reducing the potential risks of spaces such as high-containment laboratories.	May 2022	$400,000	Biorisk and Recovery from Catastrophe	
Effective Ideas Blog Prize	Longview Philanthropy and the Future Fund recommended a grant to support prizes for outstanding writing which encourages a broader public conversation around effective altruism and longtermism.	January 2022	$900,000	Values and Reflective Processes|Effective Altruism	https://effectiveideas.org/
Pathos Labs, PopShift	We recommended a grant to support Pathos Labs to produce a PopShift convening connecting experts on the future of technology and existential risks with television writers to inspire new ideas for their shows.		$50,000	Values and Reflective Processes	
Piezo Therapeutics	We recommended an investment to support work on technology for delivering mRNA vaccines without lipid nanoparticles with the aim of making vaccines more safe, affordable, and scalable.	May 2022	$1,000,000	Biorisk and Recovery from Catastrophe	